Amazon Brand - Symbol Men's Regular Fit Polo Shirt,299,src/main/resources/data/images/fashion/Mens TShirts0.webp
AMERICAN CREW Men's Polo Collar Half Sleeve T-Shirt,599,src/main/resources/data/images/fashion/Mens TShirts1.webp
AMERICAN CREW Polo T-Shirts for Men,614,src/main/resources/data/images/fashion/Mens TShirts2.webp
Amazon Brand - Symbol Men's Regular Polo Shirt,309,src/main/resources/data/images/fashion/Mens TShirts3.webp
Scott International Men's Cotton Regular Fit Solid Polo Neck T-Shirt,399,src/main/resources/data/images/fashion/Mens TShirts4.webp
LEOTUDE Regular Fit Full Sleeve Cotton Blend Men's T-Shirt,309,src/main/resources/data/images/fashion/Mens TShirts5.webp
LEOTUDE Regular Fit Half Sleeve Polo T-Shirt for Men,309,src/main/resources/data/images/fashion/Mens TShirts6.webp
Amazon Brand - Symactive Men's Regular Fit T-Shirt,319,src/main/resources/data/images/fashion/Mens TShirts7.webp
Max Men's Polo T-Shirt Slim,349,src/main/resources/data/images/fashion/Mens TShirts8.webp
Van Heusen Men's Regular Fit Polo Shirt,629,src/main/resources/data/images/fashion/Mens TShirts9.webp
EYEBOGLER Men T-Shirt,308,src/main/resources/data/images/fashion/Mens TShirts10.webp
LEOTUDE Regular Fit Half Sleeve Polo Men's T-Shirt,309,src/main/resources/data/images/fashion/Mens TShirts11.webp
JUGULAR Men's Cotton Printed T-Shirt,319,src/main/resources/data/images/fashion/Mens TShirts12.webp
Chromozome Regular Mens Tshirts,399,src/main/resources/data/images/fashion/Mens TShirts13.webp
Allen Solly Men's Regular Fit Polo,719,src/main/resources/data/images/fashion/Mens TShirts14.webp
Scott International Men's Regular Fit T-Shirt (Pack of 3),419,src/main/resources/data/images/fashion/Mens TShirts15.webp
Jockey Men's Regular Fit Round Neck Half Sleeved T-Shirt,548,src/main/resources/data/images/fashion/Mens TShirts16.webp
Allen Solly Men Polo,629,src/main/resources/data/images/fashion/Mens TShirts17.webp
LEOTUDE Men's Regular Fit Cotton Blend Full Sleeve T-Shirt,279,src/main/resources/data/images/fashion/Mens TShirts18.webp
EYEBOGLER Men's T-Shirt,338,src/main/resources/data/images/fashion/Mens TShirts19.webp
NEWPORT Men Men Blue Cotton Heathered Polo Shirt,459,src/main/resources/data/images/fashion/Mens TShirts20.webp
AMERICAN CREW Full Sleeves Polo Collar T-Shirt for Men,699,src/main/resources/data/images/fashion/Mens TShirts21.webp
AMERICAN CREW Polo Collar Cotton Poly Striped T-Shirt for Men,599,src/main/resources/data/images/fashion/Mens TShirts22.webp
Jockey Men's Regular Fit Round Neck Half Sleeved T-Shirt,499,src/main/resources/data/images/fashion/Mens TShirts23.webp
Amazon Brand - Symbol Men's Regular T-Shirt,489,src/main/resources/data/images/fashion/Mens TShirts24.webp
fanideaz Mens Cotton Half Sleeve Striped Polo T Shirt with Collar,599,src/main/resources/data/images/fashion/Mens TShirts25.webp
AELOMART Men's T Shirt,497,src/main/resources/data/images/fashion/Mens TShirts26.webp
LEOTUDE Cottonblend Half Sleeve Back Print Oversized T-Shirts for Men,314,src/main/resources/data/images/fashion/Mens TShirts27.webp
London Hills Printed Men's Round Neck Black T-Shirt,349,src/main/resources/data/images/fashion/Mens TShirts28.webp
EYEBOGLER Regular Men's Cotton Designer T-Shirt (EB1T67),278,src/main/resources/data/images/fashion/Mens TShirts29.webp
Van Heusen Athleisure Men's Regular fit T-Shirt (IHTS1LXD60044_Black S),419,src/main/resources/data/images/fashion/Mens TShirts30.webp
Urbano Fashion Men's Printed Full Sleeve Slim Fit Cotton T-Shirt,357,src/main/resources/data/images/fashion/Mens TShirts31.webp
U.S. POLO ASSN. Men's Striped Regular fit Polo (USTSH0919_White_XL),949,src/main/resources/data/images/fashion/Mens TShirts32.webp
Maniac Color Block Men's Fullsleeve Hooded Yellow Cotton Tshirt,259,src/main/resources/data/images/fashion/Mens TShirts33.webp
EYEBOGLER Men's Checkered Regular Fit T-Shirt (T51_Black XL),178,src/main/resources/data/images/fashion/Mens TShirts34.webp
Veirdo 100% Cotton Oversize Drop Shoulder Loose Fit Round Neck Graphic Doodle Printed T-Shirt for Men & Boys,429,src/main/resources/data/images/fashion/Mens TShirts35.webp
U.S. POLO ASSN. Men's Striped Regular fit Polo (USTSH0919_White_L),949,src/main/resources/data/images/fashion/Mens TShirts36.webp
LEOTUDE Cotton Blend Half Sleeve Printed Oversized T-Shirts for Men,278,src/main/resources/data/images/fashion/Mens TShirts37.webp
Levi's Men T-Shirt,549,src/main/resources/data/images/fashion/Mens TShirts38.webp
U.S. POLO ASSN. Men's Striped Regular fit Polo (USTSH0919_White_M),949,src/main/resources/data/images/fashion/Mens TShirts39.webp
Cazibe Regular Men's T-Shirt,379,src/main/resources/data/images/fashion/Mens TShirts40.webp
LEOTUDE Regular Fit Cottonblend Full Sleeve Printed Men's T-Shirt,279,src/main/resources/data/images/fashion/Mens TShirts41.webp
Alan Jones Clothing Men's Slim Fit Polo T-Shirt,399,src/main/resources/data/images/fashion/Mens TShirts42.webp
London Hills Men's Regular Fit T-Shirt,249,src/main/resources/data/images/fashion/Mens TShirts43.webp
London Hills Solid Men's Round Neck Sports T-Shirt,199,src/main/resources/data/images/fashion/Mens TShirts44.webp
Veirdo 100% Cotton Oversize Drop Shoulder Loose Fit Round Neck Half Sleeve Animal Printed T-Shirt for Men/Boys,324,src/main/resources/data/images/fashion/Mens TShirts45.webp
LEOTUDE NEON Green Cotton Blend Half Sleeve Printed Oversized T-Shirts for Men,314,src/main/resources/data/images/fashion/Mens TShirts46.webp
LEOTUDE Oversized Cotton Blend Half Sleeve Mens T-Shirts,314,src/main/resources/data/images/fashion/Mens TShirts47.webp
Amazon Brand - Symbol Men's Regular T-Shirt,409,src/main/resources/data/images/fashion/Mens TShirts48.webp
Allen Solly Men's Regular Fit T-Shirt,389,src/main/resources/data/images/fashion/Mens TShirts49.webp
Austin Wood Men's Regular Fit T-Shirt,399,src/main/resources/data/images/fashion/Mens TShirts50.webp
AMERICAN CREW Men's Polo Collar Half Sleeve T-Shirt,599,src/main/resources/data/images/fashion/Mens TShirts51.webp
Van Heusen Men Polo T-Shirt - Ultra Soft - Short Sleeve - Cotton Blend,733,src/main/resources/data/images/fashion/Mens TShirts52.webp
LEOTUDE Cotton Blend Half Sleeve Back Print Oversized T-Shirts for Men,314,src/main/resources/data/images/fashion/Mens TShirts53.webp
Levi's Men's Regular Fit T-Shirt,838,src/main/resources/data/images/fashion/Mens TShirts54.webp
AWG ALL WEATHER GEAR Men's Dryfit Round Neck T-Shirts - Pack of 3,298,src/main/resources/data/images/fashion/Mens TShirts55.webp
Amazon Brand - Symbol Men's Regular T-Shirt,489,src/main/resources/data/images/fashion/Mens TShirts56.webp
fanideaz Mens Cotton Half Sleeve Striped Polo T Shirt with Collar,599,src/main/resources/data/images/fashion/Mens TShirts57.webp
AMERICAN CREW Men's Polo Striped T-Shirt,614,src/main/resources/data/images/fashion/Mens TShirts58.webp
Amazon Brand - Symbol Men's Regular Fit T-Shirt,179,src/main/resources/data/images/fashion/Mens TShirts59.webp
