IRIS Reed Diffuser Fragrance Gift Set -French Lavender (INFG0314FL),546,src/main/resources/data/images/miscellaneous/Gifts0.png
Bella Vita Organic Aroma Candles Soy Wax 4 X 60g each - Vanilla - Cinnamon - Lavender & Rose - Upto 15 hours - b...,324,src/main/resources/data/images/miscellaneous/Gifts1.png
IRIS Ceramic Fragrant Gift Pack (Brown),525,src/main/resources/data/images/miscellaneous/Gifts2.png
Handmade Wooden Carving Owl Statue Beautiful Animal Figurines Showpiece Gifts for Home Decoration,599,src/main/resources/data/images/miscellaneous/Gifts3.png
Paperkraft Expressions Gift Pack (Roller Ball Pen + Ball Pen)|Premium Metal Body Pens|Classic & Elegant Matte Blue Finish|...,392,src/main/resources/data/images/miscellaneous/Gifts4.png
3D Moon Lamp 7 Colour Changeable Sensor Moon Night Light Lamp - Touch Control - Moonlight Lamp with Stand & USB for Bedrooms...,616,src/main/resources/data/images/miscellaneous/Gifts5.png
StarLaser 20 Reasons Why I Need You Message Box Gift For Anniversary Birthday And Loveable Person(Engineered Wood - Brown),218,src/main/resources/data/images/miscellaneous/Gifts6.png
International Gift German Silver Brass Solid Round Bowl Set With Tray And Spoon With Blue Velvet Box Used for Dry Fruit - S...,447,src/main/resources/data/images/miscellaneous/Gifts7.png
Collectible India Ganesh Idol on Leaf - Lord Ganesha with Diya - Metal Hand Craved for Home Decorative Gift Puja Gifts Cor...,274,src/main/resources/data/images/miscellaneous/Gifts8.png
Collectible India Peacock Design Radha Krishna Idol Showpiece with Diya for Puja and Home Decor (8 x 6 Inches) - Metal - Gol...,380,src/main/resources/data/images/miscellaneous/Gifts9.png
