Lizol Kitchen Power Cleaner Liquid Spray - 450ml | Kills 99.9% germs | Cleans Stove - Chimney & Sink,112,/run/media/krishnaraj/Programs/Java/How Much/src/main/resources/data/images/household/Cleaning Products4.png
Winberg ® Car Cleaning Combo Pack Microfiber Towel 3 pcs 1 Carpet Brush 1 Washing Scurb Microfibre Gloves full Interior an...,426,/run/media/krishnaraj/Programs/Java/How Much/src/main/resources/data/images/household/Cleaning Products5.png
VazzLox Kitchen Cleaner Spray Oil & Grease Stain Remover Stove & Chimney Cleaner Spray Non-Flammable Nontoxic Magic Degrea...,349,/run/media/krishnaraj/Programs/Java/How Much/src/main/resources/data/images/household/Cleaning Products6.png
Harpic Disinfectant Bathroom Cleaner Liquid - Lemon - 1L,179,/run/media/krishnaraj/Programs/Java/How Much/src/main/resources/data/images/household/Cleaning Products7.png
JOFF Tap and Shower Cleaner - 250ml,175,/run/media/krishnaraj/Programs/Java/How Much/src/main/resources/data/images/household/Cleaning Products8.png
Mode Koorts Jala Broom & Feather Duster with Long Rod & Extendable Handle - Static Duster For Multipurpose - Used For Fan - R...,295,/run/media/krishnaraj/Programs/Java/How Much/src/main/resources/data/images/household/Cleaning Products9.png
