Cadbury Celebrations Premium Chocolate Gift Pack Pouch - 2 x 217.8 g,440,src/main/resources/data/images/miscellaneous/Gifts0.webp
Cadbury Dairy Milk Silk Pralines Chocolate Gift Box -  264 g,275,src/main/resources/data/images/miscellaneous/Gifts1.webp
Cadbury Celebrations Silk Special Selection Gift Pack - Assorted - 233 g,209,src/main/resources/data/images/miscellaneous/Gifts2.webp
Kai Gift Box Hocho Utility Knife (M) 14.5 cm - 2 Hocho Utility Knife (S) 12.5 cm - Black Stainless Steel Knif...,490,src/main/resources/data/images/miscellaneous/Gifts3.webp
Paperkraft Expressions Gift Pack (Roller Ball Pen + Ball Pen)|Premium Metal Body Pens|Classic & Elegant Matte Blue Finish|...,298,src/main/resources/data/images/miscellaneous/Gifts4.webp
Collectible India Ganesh Idol on Leaf - Lord Ganesha with Diya - Metal Hand Craved for Home Decorative Gift Puja Gifts Cor...,274,src/main/resources/data/images/miscellaneous/Gifts5.webp
3D Moon Lamp 7 Colour Changeable Sensor Moon Night Light Lamp - Touch Control - Moonlight Lamp with Stand & USB for Bedrooms...,616,src/main/resources/data/images/miscellaneous/Gifts6.webp
Collectible India Peacock Design Radha Krishna Idol Showpiece with Diya for Puja and Home Decor (8 x 6 Inches) - Metal - Gol...,372,src/main/resources/data/images/miscellaneous/Gifts7.webp
HERSHEY'S Kisses Moments Chocolate Gift Pack - 193.5,360,src/main/resources/data/images/miscellaneous/Gifts8.webp
Cadbury Oreo Moments Gift Pack - 500g,164,src/main/resources/data/images/miscellaneous/Gifts9.webp
Giftplease Customized Photo and song Spotify Plaque With Steel Removable Stand | Personalized Printed Frame with scannable...,299,src/main/resources/data/images/miscellaneous/Gifts10.webp
Cadbury Celebrations Rich Dry Fruit Collection Chocolate Gift Box - 177 g,375,src/main/resources/data/images/miscellaneous/Gifts11.webp
Valentine Gift By Shining Diva Italian Designer Non Precious Metal Jewellery Set for Women (Blue) (rrsdcmb208),320,src/main/resources/data/images/miscellaneous/Gifts12.webp
Parker Vector Camouflage Gift Set - Roller Ball Pen & Parker Logo Keychain (Black Body - Blue Ink) - 2 Piece Set,299,src/main/resources/data/images/miscellaneous/Gifts13.webp
eCraftIndia Metal Lord Ganesha in Red Dhoti on Green Leaf Wall Hanging (AGG512_GN) - Multicolour,199,src/main/resources/data/images/miscellaneous/Gifts14.webp
mCaffeine Moment Skin Care Gift Set for Women & Men in Premium Gift Box | Gift Kit for Diwali & Bhai Dooj | Gift Hamper wi...,1149,src/main/resources/data/images/miscellaneous/Gifts15.webp
StarLaser 20 Reasons Why I Need You Message Box Gift For Anniversary Birthday And Loveable Person(Engineered Wood - Brown),218,src/main/resources/data/images/miscellaneous/Gifts16.webp
Parker Vector Gift Set - Parker Roller Ball Pen with Parker logo Round Key Chain (Ink - Blue),397,src/main/resources/data/images/miscellaneous/Gifts17.webp
Interlife Gift Studio White Metal Bowl Set - 2 Pieces,115,src/main/resources/data/images/miscellaneous/Gifts18.webp
JR Gifts And Handicrafts Brass Silver Plated Floral Bowls  - Spoon with Plate In Royal Velvet Gift Box ( Silver ) - 5 Pieces,248,src/main/resources/data/images/miscellaneous/Gifts19.webp
Bella Vita Organic Aroma Candles Soy Wax 4 X 60g each - Vanilla - Cinnamon - Lavender & Rose - Upto 15 hours - b...,299,src/main/resources/data/images/miscellaneous/Gifts20.webp
IRIS Reed Diffuser Fragrance Gift Set -French Lavender (INFG0314FL),546,src/main/resources/data/images/miscellaneous/Gifts21.webp
Xergy 10 cm 3D Rechargeable Moon Lamp with Touch Control Adjust Brightness Moon Light with Wooden Stand 3D ...,649,src/main/resources/data/images/miscellaneous/Gifts22.webp
Bella Vita Organic Aroma Candles for Home Decor 4 X 60g Each - (Pack of 2) - Vanilla - Cinnamon - Lavender & R...,599,src/main/resources/data/images/miscellaneous/Gifts23.webp
Asera Birthday Return Gifts Kaleidoscope (12 Pcs) Children Educational Fun Magic Science Toy,665,src/main/resources/data/images/miscellaneous/Gifts24.webp
Orion Chocopie festive Gift pack (20 pies)|Premium Chocolate gift pack | Diwali gift pack,166,src/main/resources/data/images/miscellaneous/Gifts25.webp
KridayKraft Prince Home Decor & Gifts Metal Krishna With Cow Standing Under Tree Plying Flute (Gold - 12.5X8X16Cm) - 1 Piece,279,src/main/resources/data/images/miscellaneous/Gifts26.webp
Giftana Vacuum Flask Set with 3 Stainless Steel Cups Combo - 500ml - Odourless & Keeps Liquid Hot & Cold- Diwali Gift - Chr...,835,src/main/resources/data/images/miscellaneous/Gifts27.webp
SparkleBox Tie & Dye Art Kit (Skin Friendly) |Gift for Kids 9 -10 -11 -12 Years and Above. | 5 in 1 Projects - White Tshirt -4 ...,565,src/main/resources/data/images/miscellaneous/Gifts28.webp
Bombay Shaving Co Bath & Skin Glow Kit | Diwali Gift Kit | Charcoal Face wash - Peel Off Mask - Face Pack - Sheet mask - Exfol...,726,src/main/resources/data/images/miscellaneous/Gifts29.webp
ITOS365 Jewellery Box for Women Wooden Flip Flap Flower Carved Design Handmade Gift - 8 inches,499,src/main/resources/data/images/miscellaneous/Gifts30.webp
LEMISH Phone Docking Station Hooks Key Holder Wallet Stand Watch Organizer Plywood Personalized for Men Customized tech Me...,497,src/main/resources/data/images/miscellaneous/Gifts31.webp
Paper Boat Assorted Dry Fruits Gift Pack - 400g| Kaju Badam Mixed Nuts| Diwali Gift Hamper I Premium Festive Gift Box,540,src/main/resources/data/images/miscellaneous/Gifts32.webp
Shaivya Acrylic Customized Photo Printed Musical Plaque - Personalized Spotify Plaque With Scannable Code And Your Photo - C...,299,src/main/resources/data/images/miscellaneous/Gifts33.webp
Lavie Women's Betula Tote Bag | Ladies Purse Handbag,999,src/main/resources/data/images/miscellaneous/Gifts34.webp
Ferrero Rocher Moments,293,src/main/resources/data/images/miscellaneous/Gifts35.webp
TIED RIBBONS Pack of 6 Mosaic Glass Votive Tealight Candle Holders - Diwali Decoration Items for Home Living Room Bedroom ...,899,src/main/resources/data/images/miscellaneous/Gifts36.webp
Perfumer's Club ""Best Fragrance for Men 2020"" Gift Set of 3(Into The Wild + Wild Child + Wanderer) Upto 24 hrs lasting (Ea...,799,src/main/resources/data/images/miscellaneous/Gifts37.webp
Wembley Toys LCD Writing Pad Tablet Birthday Gift for Boys and Girls 8.5 Inch Digital Slate for Kids Learning Educational ...,235,src/main/resources/data/images/miscellaneous/Gifts38.webp
ADR Plastic NL Traders 3D Illusion LED Light Night Lights for 7 Colors Led Changing Lighting Bedroom Decoration Decorative...,145,src/main/resources/data/images/miscellaneous/Gifts39.webp
Cheeksy Tom & Jerry Smile Printed Coffee Tea Milk Mug 300 ml Quote | Cartoon | Gift for Couple | Daughter | Birthday | Fri...,172,src/main/resources/data/images/miscellaneous/Gifts40.webp
Solobolo Madhubani Painting Kit Tea Coasters with Stand | Art and Craft Kit for Girls 9-12 | Madhubani Art Kit for Girls 1...,699,src/main/resources/data/images/miscellaneous/Gifts41.webp
YouBella Pocket Watch Pendant with Chain for Husband Unique Memorable Gift Dual Purpose Stainless Steel Clock for Men (YBW...,329,src/main/resources/data/images/miscellaneous/Gifts42.webp
Scrapbook Photo Album Diary Creative Gifts for Anniversary and Birthday DIY size 24 cm x 18 cm,320,src/main/resources/data/images/miscellaneous/Gifts43.webp
Odzeni Crystal Rose Diamond 16 Color Rgb Changing Mode Led Night Lights - Usb Remote And Touch Control Desk Lamp For Bedro...,999,src/main/resources/data/images/miscellaneous/Gifts44.webp
Gifts Online Wish Pearl in Oyster Pendant Necklace with Earrings - Valentine Special Gift (Assorted Colours),325,src/main/resources/data/images/miscellaneous/Gifts45.webp
Collectible India Laxmi Ganesh Saraswati Idol Diya Oil Lamp Deepak - Metal Lakshmi Ganesha Showpiece Statue - Traditional ...,538,src/main/resources/data/images/miscellaneous/Gifts46.webp
Friendskart Customized Spotify Keychain With Song Code & Photo - Personalized Gifts For Her/Him With Scannable Song Code | ...,99,src/main/resources/data/images/miscellaneous/Gifts47.webp
Bakku Toys Unicorn Soft Toys for Girls Gift | Teddy |Birthday Gift Boy/Girl | Lovable hugable Cute Giant Life Size - Long S...,198,src/main/resources/data/images/miscellaneous/Gifts49.webp
DPISZONE Kids Night Light Toys for 2-8 Year Old Girls Gifts - Moon Star Projector Light for Kids - 360 Degree Rotation and 8...,538,src/main/resources/data/images/miscellaneous/Gifts50.webp
DECOR Airplane Showpiece Metal Pen Stand for Office Table - Pencil Holder - Single Compartment Desk Organizers with Happy Sm...,549,src/main/resources/data/images/miscellaneous/Gifts51.webp
Keeros Healthy Bhai Dooj Gift for Brother with Moli Chandan Tikka Chawal Mishri : Variety of Sweet & Salted - Tasty & Nutri...,450,src/main/resources/data/images/miscellaneous/Gifts52.webp
TC The Customizers Wooden Square Shadow Box with Electric Night Lamp - Best Customized or Personalized Gifts | Birthday Gif...,380,src/main/resources/data/images/miscellaneous/Gifts53.webp
Chhariya Crafts Metal Lord Ganesha Reading Ramayana Statue Ganpati Sitting on Chair with Kuber Diya Idol for Home Office a...,440,src/main/resources/data/images/miscellaneous/Gifts54.webp
International Gift German Silver Brass Solid Round Bowl Set With Tray And Spoon With Blue Velvet Box Used for Dry Fruit - S...,447,src/main/resources/data/images/miscellaneous/Gifts55.webp
Amazon Brand - Solimo Colored Wax Tealight Candles (Set of 100 - Unscented),359,src/main/resources/data/images/miscellaneous/Gifts56.webp
Kai Gift Box Hocho Premium Chef Knife 7.36 Inc. Blade - Black - Stainless Steel Knife.,457,src/main/resources/data/images/miscellaneous/Gifts57.webp
IRIS Ceramic Fragrant Gift Pack (Brown),500,src/main/resources/data/images/miscellaneous/Gifts58.webp
GKT Female Dress Mannequin Form Natural Wheel Base Mannequin Premium Store Display Dummy Mannequin Dummy Mo...,4299,src/main/resources/data/images/miscellaneous/Gifts59.webp
